{
  "$schema": "https://json-schema.org/draft/2020-12/schema",
  "$id": "https://github.com/sfr9802/async-ai-document-pipeline-with-domain-rag/blob/main/docs/agentops_trace_schema.json",
  "title": "AgentOps Run Trace",
  "type": "object",
  "required": [
    "schema_version",
    "run_id",
    "query",
    "request_context",
    "selected_tools",
    "tools_called",
    "retrieval_namespace",
    "indexing_scope",
    "evidence_ids",
    "answerability_label",
    "answerability_label_source",
    "relevance_label",
    "relevance_label_source",
    "policy_decision",
    "diagnostic_only",
    "retry_repair_fallback",
    "failure_category",
    "final_decision",
    "report_artifact_path"
  ],
  "properties": {
    "schema_version": {
      "const": "agentops_run_trace_v1"
    },
    "run_id": {
      "type": "string",
      "minLength": 1,
      "maxLength": 128,
      "pattern": "^[A-Za-z0-9][A-Za-z0-9._-]{0,127}$",
      "description": "Safe trace run identifier; local paths, whitespace, and control characters are rejected before persistence."
    },
    "query": {
      "type": "string",
      "pattern": "^query_ref:[0-9a-f]{16}$",
      "description": "Opaque run-level query reference; raw prompts and content-derived prompt hashes are not persisted."
    },
    "request_context": {
      "type": "object",
      "required": [
        "source_family",
        "namespace",
        "indexing_scope",
        "answer_format_requirement",
        "official_requested"
      ],
      "properties": {
        "source_family": {
          "enum": ["PDF", "TEXT", "XLSX", "UNSUPPORTED_SOURCE_FAMILY"]
        },
        "namespace": {
          "enum": [
            "rag-data-all-source-citable-nonprod-v1",
            "rag-data-all-source-nonprod-v1",
            "rag-data-live-runtime-smoke-nonprod",
            "reports/rag_eval/rag-ingestion/runs",
            "UNSUPPORTED_NAMESPACE"
          ]
        },
        "indexing_scope": {
          "enum": ["nonprod_source_derived_read_only", "UNSUPPORTED_INDEXING_SCOPE"]
        },
        "answer_format_requirement": {
          "enum": ["answer_with_citations_or_abstain", "UNSUPPORTED_ANSWER_FORMAT_REQUIREMENT"]
        },
        "official_requested": {
          "type": "boolean"
        }
      },
      "additionalProperties": false
    },
    "selected_tools": {
      "type": "array",
      "maxItems": 6,
      "uniqueItems": true,
      "description": "Schema-known AgentOps tools selected for the trace; unsupported-tool fail-closed traces clear this list instead of persisting requested tool names.",
      "items": {
        "enum": [
          "retrieve_txt_corpus",
          "retrieve_xlsx_table",
          "retrieve_pdf_ocr",
          "validate_evidence",
          "classify_answerability",
          "generate_eval_report"
        ]
      }
    },
    "tools_called": {
      "type": "array",
      "maxItems": 9,
      "uniqueItems": true,
      "items": {
        "enum": [
          "rag.l0.query_routing",
          "rag.l1.coarse_candidate_generation",
          "rag.l2.file_workbook_identity",
          "rag.l3.structural_locator",
          "rag.l4.sourceatom_hydration",
          "rag.l5.evidence_bundle_assembly",
          "rag.l6.evidence_selector",
          "rag.l7.answer_ready_context",
          "rag.l8.final_llm_answer_generation"
        ]
      },
      "description": "Schema-known runtime tool call names; unknown tool names are not persisted in valid traces."
    },
    "retrieval_namespace": {
      "enum": [
        "rag-data-all-source-citable-nonprod-v1",
        "rag-data-all-source-nonprod-v1",
        "rag-data-live-runtime-smoke-nonprod",
        "reports/rag_eval/rag-ingestion/runs",
        "UNSUPPORTED_NAMESPACE"
      ]
    },
    "indexing_scope": {
      "enum": ["nonprod_source_derived_read_only", "UNSUPPORTED_INDEXING_SCOPE"]
    },
    "evidence_ids": {
      "type": "array",
      "maxItems": 99,
      "items": {
        "type": "string",
        "pattern": "^evidence_ref:[0-9]{2}$"
      },
      "description": "Opaque EvidenceBundle references scoped to this trace; raw bundle/source atom ids and locators are not persisted."
    },
    "answerability_label": {
      "enum": [
        "diagnostic_answerable_from_bounds",
        "diagnostic_unanswerable_from_bounds"
      ]
    },
    "answerability_label_source": {
      "const": "machine_policy_not_gold"
    },
    "relevance_label": {
      "type": "string",
      "maxLength": 0
    },
    "relevance_label_source": {
      "const": "not_evaluated_without_user_gold"
    },
    "policy_decision": {
      "enum": ["allow_diagnostic", "fail_closed"]
    },
    "diagnostic_only": {
      "const": true
    },
    "retry_repair_fallback": {
      "type": "object",
      "required": [
        "max_retry_count",
        "retry_attempted",
        "retry_requires_new_allowed_signal",
        "repair_attempted",
        "fallback_decision",
        "diagnostic_only_on_ambiguous_answerability",
        "unbounded_retry_allowed",
        "failure_category"
      ],
      "properties": {
        "max_retry_count": {
          "type": "integer",
          "minimum": 0,
          "maximum": 1
        },
        "retry_attempted": {
          "type": "boolean"
        },
        "retry_requires_new_allowed_signal": {
          "const": true
        },
        "repair_attempted": {
          "type": "boolean"
        },
        "fallback_decision": {
          "enum": ["not_needed", "fail_closed"]
        },
        "diagnostic_only_on_ambiguous_answerability": {
          "const": true
        },
        "unbounded_retry_allowed": {
          "const": false
        },
        "failure_category": {
          "enum": [
            "",
            "ambiguous_file_identity",
            "ambiguous_page_only_locator",
            "ambiguous_sheet_only_locator",
            "ambiguous_workbook_identity",
            "answer_format_blocked",
            "cache_namespace_mismatch",
            "candidate_scope_missing",
            "candidate_scope_source_family_mismatch",
            "context_required",
            "index_namespace_mismatch",
            "index_unavailable",
            "indexing_scope_blocked",
            "insufficient_evidence",
            "location_not_found",
            "missing_evidence",
            "namespace_mismatch",
            "no_candidate_evidence_scope",
            "no_evidence",
            "official_policy_not_opened",
            "out_of_bounds_locator",
            "report_artifact_path_blocked",
            "request_context_malformed",
            "reserved_request_context_key",
            "runtime_contract_violation",
            "runtime_fail_closed",
            "runtime_tool_call_drift",
            "source_atom_hydration_unbounded",
            "source_atom_id_missing_or_unauthorized",
            "source_atom_store_namespace_mismatch",
            "source_atom_store_unavailable",
            "source_family_mismatch",
            "unsupported",
            "unsupported_evidence_only_tool_path",
            "unsupported_locator_format",
            "unsupported_source_family",
            "unsupported_tool"
          ]
        }
      },
      "additionalProperties": false
    },
    "failure_category": {
      "enum": [
        "",
        "ambiguous_file_identity",
        "ambiguous_page_only_locator",
        "ambiguous_sheet_only_locator",
        "ambiguous_workbook_identity",
        "answer_format_blocked",
        "cache_namespace_mismatch",
        "candidate_scope_missing",
        "candidate_scope_source_family_mismatch",
        "context_required",
        "index_namespace_mismatch",
        "index_unavailable",
        "indexing_scope_blocked",
        "insufficient_evidence",
        "location_not_found",
        "missing_evidence",
        "namespace_mismatch",
        "no_candidate_evidence_scope",
        "no_evidence",
        "official_policy_not_opened",
        "out_of_bounds_locator",
        "report_artifact_path_blocked",
        "request_context_malformed",
        "reserved_request_context_key",
        "runtime_contract_violation",
        "runtime_fail_closed",
        "runtime_tool_call_drift",
        "source_atom_hydration_unbounded",
        "source_atom_id_missing_or_unauthorized",
        "source_atom_store_namespace_mismatch",
        "source_atom_store_unavailable",
        "source_family_mismatch",
        "unsupported",
        "unsupported_evidence_only_tool_path",
        "unsupported_locator_format",
        "unsupported_source_family",
        "unsupported_tool"
      ]
    },
    "final_decision": {
      "enum": ["diagnostic_only_answer", "diagnostic_only_handoff", "fail_closed"]
    },
    "report_artifact_path": {
      "const": "reports/portfolio_agentops_report.md",
      "description": "Canonical portfolio report artifact path; local absolute paths, parent traversal, and ad-hoc report paths are not persisted."
    }
  },
  "allOf": [
    {
      "if": {
        "properties": {
          "policy_decision": {
            "const": "allow_diagnostic"
          }
        },
        "required": ["policy_decision"]
      },
      "then": {
        "properties": {
          "request_context": {
            "properties": {
              "source_family": {
                "enum": ["PDF", "TEXT", "XLSX"]
              },
              "namespace": {
                "enum": [
                  "rag-data-all-source-citable-nonprod-v1",
                  "rag-data-all-source-nonprod-v1",
                  "rag-data-live-runtime-smoke-nonprod",
                  "reports/rag_eval/rag-ingestion/runs"
                ]
              },
              "indexing_scope": {
                "const": "nonprod_source_derived_read_only"
              },
              "answer_format_requirement": {
                "const": "answer_with_citations_or_abstain"
              },
              "official_requested": {
                "const": false
              }
            }
          },
          "retrieval_namespace": {
            "enum": [
              "rag-data-all-source-citable-nonprod-v1",
              "rag-data-all-source-nonprod-v1",
              "rag-data-live-runtime-smoke-nonprod",
              "reports/rag_eval/rag-ingestion/runs"
            ]
          },
          "indexing_scope": {
            "const": "nonprod_source_derived_read_only"
          }
        }
      }
    }
  ],
  "additionalProperties": false
}
